{
  "apiVersion": "launchroom.vantezzen.io/v1",
  "kind": "RegistryTokenRequest",
  "scopes": [
    { "repository": "apps/svc_01j9z8x7w6v5t4s3r2q1p0n9n2", "actions": ["pull", "push"] },
    { "repository": "cache/svc_01j9z8x7w6v5t4s3r2q1p0n9n2", "actions": ["pull", "push"] },
    { "repository": "mirror/ghcr.io/railwayapp/railpack-frontend", "actions": ["pull"] }
  ],
  "task": "tsk_01J9Z8X7W6V5T4S3R2Q1P0N9P0"
}
